{
  "id": "furniture_signal_junction_box",
  "family": "road_furniture",
  "semantic_class": "furniture.signal_junction_box",
  "variant_key": "pedestal",
  "dimensions_m": {
    "width": 0.46,
    "height": 0.68,
    "depth": 0.46
  },
  "lods": [
    {
      "name": "LOD0",
      "triangle_count": 60,
      "usd_scope": "/furniture_signal_junction_box/LOD0",
      "gltf_node_prefix": "LOD0"
    },
    {
      "name": "LOD1",
      "triangle_count": 36,
      "usd_scope": "/furniture_signal_junction_box/LOD1",
      "gltf_node_prefix": "LOD1"
    }
  ],
  "collider": {
    "type": "box",
    "width": 0.46,
    "height": 0.68,
    "depth": 0.46
  },
  "anchor_points": {
    "base_center": {
      "x": 0.0,
      "y": 0.0,
      "z": 0.0
    }
  },
  "materials": [
    "mat_concrete",
    "mat_metal_galvanized",
    "mat_signal_housing"
  ],
  "states": {
    "default": {
      "render_profile": "static"
    }
  },
  "export_targets": {
    "usd_ascii": "canonical/geometry/usd/furniture_signal_junction_box.usda",
    "usd_binary": "exports/usd/furniture_signal_junction_box.usdc",
    "gltf_binary": "exports/gltf/furniture_signal_junction_box.glb"
  },
  "license": {
    "spdx": "LicenseRef-ProjectGenerated",
    "redistribution": "geometry, manifests, and templates generated in-repo"
  },
  "provenance": {
    "generated_at": "2026-04-16T10:10:40+00:00",
    "generated_by": "scripts/build_asset_pack.py",
    "note": "Generated reusable road surface, marking, or furniture primitive."
  }
}
