{
  "id": "sign_yield_weathered_heavy",
  "family": "traffic_sign",
  "semantic_class": "regulatory.yield",
  "variant_key": "weathered.yield.heavy",
  "dimensions_m": {
    "width": 0.9,
    "height": 2.2,
    "depth": 0.08
  },
  "lods": [
    {
      "name": "LOD0",
      "triangle_count": 136,
      "usd_scope": "/sign_yield_weathered_heavy/LOD0",
      "gltf_node_prefix": "LOD0"
    },
    {
      "name": "LOD1",
      "triangle_count": 112,
      "usd_scope": "/sign_yield_weathered_heavy/LOD1",
      "gltf_node_prefix": "LOD1"
    }
  ],
  "collider": {
    "type": "capsule",
    "radius": 0.4,
    "height": 2.2
  },
  "anchor_points": {
    "base_center": {
      "x": 0.0,
      "y": 0.0,
      "z": 0.0
    },
    "plate_center": {
      "x": 0.0,
      "y": 1.75,
      "z": 0.0
    }
  },
  "materials": [
    "mat_metal_galvanized",
    "mat_sign_stop_red",
    "mat_sign_weathered_heavy_film",
    "mat_sign_white"
  ],
  "states": {
    "default": {
      "render_profile": "reflective_daytime"
    }
  },
  "export_targets": {
    "template_svg": "canonical/templates/signs/sign_yield_weathered_heavy.svg",
    "usd_ascii": "canonical/geometry/usd/sign_yield_weathered_heavy.usda",
    "usd_binary": "exports/usd/sign_yield_weathered_heavy.usdc",
    "gltf_binary": "exports/gltf/sign_yield_weathered_heavy.glb"
  },
  "license": {
    "spdx": "LicenseRef-ProjectGenerated",
    "redistribution": "geometry, manifests, and templates generated in-repo"
  },
  "provenance": {
    "generated_at": "2026-04-16T10:10:40+00:00",
    "generated_by": "scripts/build_asset_pack.py",
    "note": "SVG face template plus generated USD/GLB plate and pole geometry."
  }
}
