{
  "id": "road_bus_bay_pullout_lane",
  "family": "road_surface",
  "semantic_class": "road.curbside_access",
  "variant_key": "bus_bay_pullout",
  "dimensions_m": {
    "width": 4.0,
    "height": 0.16,
    "depth": 4.0
  },
  "lods": [
    {
      "name": "LOD0",
      "triangle_count": 84,
      "usd_scope": "/road_bus_bay_pullout_lane/LOD0",
      "gltf_node_prefix": "LOD0"
    },
    {
      "name": "LOD1",
      "triangle_count": 60,
      "usd_scope": "/road_bus_bay_pullout_lane/LOD1",
      "gltf_node_prefix": "LOD1"
    }
  ],
  "collider": {
    "type": "box",
    "width": 4.0,
    "height": 0.16,
    "depth": 4.0
  },
  "anchor_points": {
    "base_center": {
      "x": 0.0,
      "y": 0.0,
      "z": 0.0
    }
  },
  "materials": [
    "mat_asphalt_dry",
    "mat_concrete"
  ],
  "states": {
    "default": {
      "render_profile": "static"
    }
  },
  "export_targets": {
    "usd_ascii": "canonical/geometry/usd/road_bus_bay_pullout_lane.usda",
    "usd_binary": "exports/usd/road_bus_bay_pullout_lane.usdc",
    "gltf_binary": "exports/gltf/road_bus_bay_pullout_lane.glb"
  },
  "license": {
    "spdx": "LicenseRef-ProjectGenerated",
    "redistribution": "geometry, manifests, and templates generated in-repo"
  },
  "provenance": {
    "generated_at": "2026-04-16T10:10:40+00:00",
    "generated_by": "scripts/build_asset_pack.py",
    "note": "Generated reusable road surface, marking, or furniture primitive."
  }
}
