{
  "id": "furniture_rail_crossing_bungalow",
  "family": "road_furniture",
  "semantic_class": "furniture.rail_bungalow",
  "variant_key": "signal_logic_bungalow",
  "dimensions_m": {
    "width": 1.92,
    "height": 1.48,
    "depth": 1.24
  },
  "lods": [
    {
      "name": "LOD0",
      "triangle_count": 96,
      "usd_scope": "/furniture_rail_crossing_bungalow/LOD0",
      "gltf_node_prefix": "LOD0"
    },
    {
      "name": "LOD1",
      "triangle_count": 60,
      "usd_scope": "/furniture_rail_crossing_bungalow/LOD1",
      "gltf_node_prefix": "LOD1"
    }
  ],
  "collider": {
    "type": "box",
    "width": 1.92,
    "height": 1.48,
    "depth": 1.24
  },
  "anchor_points": {
    "base_center": {
      "x": 0.0,
      "y": 0.0,
      "z": 0.0
    }
  },
  "materials": [
    "mat_concrete",
    "mat_metal_galvanized",
    "mat_sign_black",
    "mat_signal_housing"
  ],
  "states": {
    "default": {
      "render_profile": "static"
    }
  },
  "export_targets": {
    "usd_ascii": "canonical/geometry/usd/furniture_rail_crossing_bungalow.usda",
    "usd_binary": "exports/usd/furniture_rail_crossing_bungalow.usdc",
    "gltf_binary": "exports/gltf/furniture_rail_crossing_bungalow.glb"
  },
  "license": {
    "spdx": "LicenseRef-ProjectGenerated",
    "redistribution": "geometry, manifests, and templates generated in-repo"
  },
  "provenance": {
    "generated_at": "2026-04-16T10:10:40+00:00",
    "generated_by": "scripts/build_asset_pack.py",
    "note": "Generated reusable road surface, marking, or furniture primitive."
  }
}
