{
  "id": "furniture_sign_mount_bracket_double",
  "family": "road_furniture",
  "semantic_class": "furniture.sign_mount_bracket",
  "variant_key": "double_post",
  "dimensions_m": {
    "width": 0.82,
    "height": 2.0,
    "depth": 0.09
  },
  "lods": [
    {
      "name": "LOD0",
      "triangle_count": 48,
      "usd_scope": "/furniture_sign_mount_bracket_double/LOD0",
      "gltf_node_prefix": "LOD0"
    },
    {
      "name": "LOD1",
      "triangle_count": 48,
      "usd_scope": "/furniture_sign_mount_bracket_double/LOD1",
      "gltf_node_prefix": "LOD1"
    }
  ],
  "collider": {
    "type": "box",
    "width": 0.82,
    "height": 2.0,
    "depth": 0.09
  },
  "anchor_points": {
    "base_center": {
      "x": 0.0,
      "y": 0.0,
      "z": 0.0
    }
  },
  "materials": [
    "mat_metal_galvanized"
  ],
  "states": {
    "default": {
      "render_profile": "static"
    }
  },
  "export_targets": {
    "usd_ascii": "canonical/geometry/usd/furniture_sign_mount_bracket_double.usda",
    "usd_binary": "exports/usd/furniture_sign_mount_bracket_double.usdc",
    "gltf_binary": "exports/gltf/furniture_sign_mount_bracket_double.glb"
  },
  "license": {
    "spdx": "LicenseRef-ProjectGenerated",
    "redistribution": "geometry, manifests, and templates generated in-repo"
  },
  "provenance": {
    "generated_at": "2026-04-16T10:10:40+00:00",
    "generated_by": "scripts/build_asset_pack.py",
    "note": "Generated reusable road surface, marking, or furniture primitive."
  }
}
