{
  "id": "marking_hatched_median_yellow",
  "family": "road_marking",
  "semantic_class": "marking.hatched_median",
  "variant_key": "yellow_diagonal",
  "dimensions_m": {
    "width": 0.8,
    "height": 0.005,
    "depth": 3.0
  },
  "lods": [
    {
      "name": "LOD0",
      "triangle_count": 72,
      "usd_scope": "/marking_hatched_median_yellow/LOD0",
      "gltf_node_prefix": "LOD0"
    },
    {
      "name": "LOD1",
      "triangle_count": 60,
      "usd_scope": "/marking_hatched_median_yellow/LOD1",
      "gltf_node_prefix": "LOD1"
    }
  ],
  "collider": {
    "type": "box",
    "width": 0.8,
    "height": 0.005,
    "depth": 3.0
  },
  "anchor_points": {
    "base_center": {
      "x": 0.0,
      "y": 0.0,
      "z": 0.0
    }
  },
  "materials": [
    "mat_marking_yellow"
  ],
  "states": {
    "default": {
      "render_profile": "static"
    }
  },
  "export_targets": {
    "usd_ascii": "canonical/geometry/usd/marking_hatched_median_yellow.usda",
    "usd_binary": "exports/usd/marking_hatched_median_yellow.usdc",
    "gltf_binary": "exports/gltf/marking_hatched_median_yellow.glb"
  },
  "license": {
    "spdx": "LicenseRef-ProjectGenerated",
    "redistribution": "geometry, manifests, and templates generated in-repo"
  },
  "provenance": {
    "generated_at": "2026-04-16T10:10:40+00:00",
    "generated_by": "scripts/build_asset_pack.py",
    "note": "Generated reusable road surface, marking, or furniture primitive."
  }
}
